{
  "$schema": "http://json-schema.org/draft-07/schema#",
  "$id": "https://compose.smartmemory.dev/contracts/feature-json.schema.json",
  "title": "feature.json",
  "description": "Per-feature state record at docs/features/<CODE>/feature.json. Codifies the de facto union of fields produced today by typed writers and runtime code. Intentionally permissive (additionalProperties: true) until COMP-MCP-VALIDATE-SCHEMA-TIGHTEN follow-up.",
  "type": "object",
  "additionalProperties": true,
  "required": ["code"],
  "properties": {
    "code": {
      "type": "string",
      "pattern": "^[A-Z][A-Z0-9-]*[A-Z0-9]$",
      "description": "Strict feature code. Matches FEATURE_CODE_RE_STRICT."
    },
    "description": { "type": "string" },
    "name": {
      "type": "string",
      "description": "Legacy alternative to description (de facto). Prefer description on new files."
    },
    "status": {
      "type": "string",
      "enum": ["PLANNED", "IN_PROGRESS", "PARTIAL", "COMPLETE", "SUPERSEDED", "PARKED", "BLOCKED", "KILLED"]
    },
    "phase": { "type": ["string", "null"] },
    "complexity": {
      "oneOf": [
        { "type": "string", "enum": ["S", "M", "L", "XL"] },
        { "type": "number" }
      ],
      "description": "S/M/L/XL on new files; numeric on legacy files (e.g. COMP-DEBUG-1). Convergence deferred to COMP-MCP-VALIDATE-SCHEMA-TIGHTEN."
    },
    "lane": {
      "type": "string",
      "enum": ["trivial", "standard", "complex"],
      "description": "COMP-TRIAGE-5: front-of-pipeline scope-estimation lane. Drives which build phases are skipped."
    },
    "triageTier": {
      "type": "integer",
      "minimum": 0,
      "maximum": 4,
      "description": "COMP-TRIAGE-5: raw machine tier (0-4) from the front estimator/refinement. Maps to `complexity` via tierToComplexity."
    },
    "triageConfidence": {
      "type": "string",
      "enum": ["high", "medium", "low"],
      "description": "COMP-TRIAGE-6: confidence from the front scope estimate."
    },
    "estimateSource": {
      "type": "string",
      "enum": ["front", "refined", "escalated"],
      "description": "COMP-TRIAGE-5: provenance of `lane`/`triageTier` — the front estimator, the doc-reading refinement pass, or an escalation bump."
    },
    "position": { "type": ["integer", "string"] },
    "parent": { "type": "string" },
    "depends_on": {
      "type": "array",
      "items": { "type": "string" },
      "description": "De facto field on legacy files. Cross-feature dependency codes."
    },
    "source": {
      "type": "string",
      "description": "De facto field on legacy files."
    },
    "profile": {
      "oneOf": [
        { "type": "string" },
        { "type": "object", "additionalProperties": true }
      ],
      "description": "Either a string identifier or an inline profile object (de facto on COMP-DEBUG-1 etc.)."
    },
    "created": { "type": "string", "format": "date" },
    "updated": { "type": "string", "format": "date" },
    "commit_sha": { "type": "string" },
    "tags": { "type": "array", "items": { "type": "string" } },
    "artifacts": {
      "type": "array",
      "description": "Linked non-canonical artifacts (journal/snapshot pointers, external docs). Canonical artifacts (design.md, plan.md, etc.) under the feature folder are auto-discovered and explicitly NOT registered here.",
      "items": {
        "type": "object",
        "required": ["type", "path"],
        "properties": {
          "type": { "type": "string", "enum": ["design", "prd", "architecture", "blueprint", "plan", "report", "journal", "snapshot"] },
          "path": { "type": "string" },
          "status": { "type": "string" }
        }
      }
    },
    "links": {
      "type": "array",
      "items": {
        "type": "object",
        "properties": {
          "kind": { "type": "string", "enum": ["surfaced_by", "blocks", "depends_on", "follow_up", "supersedes", "related", "external"] },
          "to_code": { "type": "string", "pattern": "^[A-Z][A-Z0-9-]*[A-Z0-9]$" },
          "note": { "type": "string" },
          "provider": { "type": "string", "enum": ["github", "forgejo", "local", "url", "jira", "linear", "notion", "obsidian"] },
          "repo": { "type": "string" },
          "issue": { "type": "integer", "minimum": 1 },
          "url": { "type": "string", "pattern": "^[a-zA-Z][a-zA-Z0-9+\\-.]*://" },
          "expect": { "type": "string" },
          "push": { "type": "boolean" }
        },
        "allOf": [
          {
            "if": { "not": { "required": ["kind"], "properties": { "kind": { "const": "external" } } } },
            "then": { "required": ["kind", "to_code"] }
          },
          {
            "if": { "properties": { "kind": { "const": "external" } }, "required": ["kind"] },
            "then": {
              "required": ["provider"],
              "allOf": [
                {
                  "if": { "properties": { "provider": { "const": "github" } }, "required": ["provider"] },
                  "then": {
                    "required": ["repo", "issue"],
                    "properties": {
                      "repo": { "pattern": "^[^\\s/#]+/[^\\s/#]+$" },
                      "expect": { "enum": ["open", "closed"] },
                      "derive_expect": { "type": "boolean" },
                      "expect_labels": { "type": "array", "items": { "type": "string", "minLength": 1 } }
                    }
                  }
                },
                {
                  "if": { "properties": { "provider": { "const": "forgejo" } }, "required": ["provider"] },
                  "then": {
                    "required": ["repo", "issue"],
                    "properties": {
                      "repo": { "pattern": "^[^\\s/#]+/[^\\s/#]+$" },
                      "expect": { "enum": ["open", "closed"] },
                      "derive_expect": { "type": "boolean" },
                      "expect_labels": { "type": "array", "items": { "type": "string", "minLength": 1 } }
                    }
                  }
                },
                {
                  "if": { "properties": { "provider": { "const": "local" } }, "required": ["provider"] },
                  "then": {
                    "required": ["repo", "to_code"],
                    "properties": {
                      "derive_expect": false,
                      "expect_labels": false,
                      "repo": {
                        "pattern": "^[A-Za-z0-9._-]+$",
                        "not": { "enum": [".", ".."] }
                      },
                      "expect": { "enum": ["PLANNED", "IN_PROGRESS", "PARTIAL", "COMPLETE", "SUPERSEDED", "PARKED", "BLOCKED", "KILLED"] }
                    }
                  }
                },
                {
                  "if": { "properties": { "provider": { "enum": ["url", "jira", "linear", "notion", "obsidian"] } }, "required": ["provider"] },
                  "then": {
                    "required": ["url"],
                    "properties": {
                      "url": { "type": "string", "pattern": "^[a-zA-Z][a-zA-Z0-9+\\-.]*://" },
                      "derive_expect": false,
                      "expect_labels": false
                    }
                  }
                }
              ]
            }
          }
        ]
      }
    },
    "completions": {
      "type": "array",
      "items": {
        "type": "object",
        "required": ["completion_id", "feature_code", "commit_sha"],
        "properties": {
          "completion_id": { "type": "string" },
          "feature_code": { "type": "string", "pattern": "^[A-Z][A-Z0-9-]*[A-Z0-9]$" },
          "commit_sha": { "type": "string", "pattern": "^[0-9a-f]{40}$" },
          "commit_sha_short": { "type": "string" },
          "tests_pass": { "type": "boolean" },
          "files_changed": { "type": "array", "items": { "type": "string" } },
          "recorded_at": { "type": "string" },
          "recorded_by": { "type": "string" },
          "notes": { "type": "string" }
        }
      }
    },
    "lifecycle": {
      "type": "object",
      "additionalProperties": true,
      "properties": {
        "currentPhase": { "type": "string" },
        "phaseHistory": { "type": "array" }
      }
    },
    "phaseHistory": {
      "type": "array",
      "description": "Empty array on every existing file today. Validator does not flag empty."
    },
    "filesChanged": {
      "type": "array",
      "items": { "type": "string" },
      "description": "Written by runBuild() on completion. De facto field; not tightened in v1."
    }
  }
}
