{
  "code": "COMP-CLI-HONEST-EXIT-1",
  "description": "Four standalone CLI commands exit 0 while doing less with no error-level signal (COMP-HOST-PORTABILITY-1 host C SD01-04): roadmap prints nothing for a populated roadmap; experiment reports complete with nCompleted 0/1; remote status omits server health when COMPOSE_API_TOKEN is unset; migrate-anon --non-interactive changes nothing and returns 0. Each must render its result or report the incomplete state distinctly (message + exit code). Gap G7.",
  "status": "PLANNED",
  "created": "2026-09-16",
  "profile": {
    "needs_prd": true,
    "needs_architecture": true,
    "needs_verification": true,
    "needs_report": true,
    "language": "node",
    "test_framework": "vitest"
  },
  "updated": "2026-09-16",
  "links": [
    {
      "kind": "surfaced_by",
      "to_code": "COMP-HOST-PORTABILITY-1",
      "note": "Gap G7; host C silent rows SD01-04"
    }
  ]
}
