{
  "code": "COMP-OBS-COST-1",
  "description": "Audit format extension: Stratum `stratum_audit` response gains per-step `input_tokens`, `output_tokens`, `cost_usd` fields. Populated from SDK result events accumulated during step execution. Stored in flow state alongside existing `duration_ms`.",
  "status": "COMPLETE",
  "phase": "COMP-OBS-COST: Token and Cost Tracking",
  "position": 208,
  "created": "2026-05-29",
  "updated": "2026-05-29"
}
