{
  "code": "COMP-CTX-1",
  "description": "Ambient context layer: `compose init` scaffolds `docs/context/` with `tech-stack.md`, `conventions.md`, `decisions.md`. These are injected into every agent prompt during `compose build` as read-only context. Updated manually or via `compose context update`.",
  "status": "COMPLETE",
  "phase": "COMP-CTX: Context Artifacts",
  "position": 125,
  "created": "2026-05-29",
  "updated": "2026-06-16",
  "completions": [
    {
      "completion_id": "COMP-CTX-1:03ebfffb946e65c1bc11a260fbb0ce6bd394ef4b",
      "feature_code": "COMP-CTX-1",
      "commit_sha": "03ebfffb946e65c1bc11a260fbb0ce6bd394ef4b",
      "commit_sha_short": "03ebfffb",
      "tests_pass": true,
      "files_changed": [
        "bin/compose.js",
        "lib/step-prompt.js",
        "test/ambient-context.test.js"
      ],
      "recorded_at": "2026-06-16T04:20:30.602Z",
      "recorded_by": "mcp:agent",
      "notes": "Stale-row reconcile (sweep 2026-06-16). Ambient context layer shipped (Wave 3 03ebfff): compose init scaffolds docs/context/{tech-stack,conventions,decisions}.md; loadAmbientContext injects them into every agent prompt. Tested. feature.json never reconciled from PLANNED."
    }
  ],
  "commit_sha": "03ebfffb946e65c1bc11a260fbb0ce6bd394ef4b"
}
