{
  "code": "COMP-SMARTMEMORY-INGEST",
  "description": "SmartMemory ingestion behind opt-in flag (default OFF): compose decision events, gate-log, audit traces, journal entries, and feature artifacts → SmartMemory items with origin=cli:compose + per-project workspace_id; backfill from append-only logs; byte-identical degrade when OFF/unreachable. Unparked from forge-top 2026-07-03.",
  "status": "COMPLETE",
  "phase": "COMP-SMARTMEMORY: SmartMemory Coupling (opt-in)",
  "created": "2026-07-03",
  "updated": "2026-07-03",
  "complexity": "L",
  "position": 1,
  "completions": [
    {
      "completion_id": "COMP-SMARTMEMORY-INGEST:fbe0de02a4817c4329daf4bd8e7d0026d9674613",
      "feature_code": "COMP-SMARTMEMORY-INGEST",
      "commit_sha": "fbe0de02a4817c4329daf4bd8e7d0026d9674613",
      "commit_sha_short": "fbe0de02",
      "tests_pass": true,
      "files_changed": [
        "lib/smartmemory-config.js",
        "lib/smartmemory-client.js",
        "lib/smartmemory-ingest.js",
        "lib/smartmemory-sync.js",
        "lib/feature-events.js",
        "server/gate-log-store.js",
        "bin/compose.js",
        "test/smartmemory-config.test.js",
        "test/smartmemory-client.test.js",
        "test/smartmemory-ingest.test.js",
        "test/smartmemory-hooks.test.js",
        "test/smartmemory-sync.test.js",
        "test/smartmemory-cli.test.js"
      ],
      "recorded_at": "2026-07-03T09:46:19.965Z",
      "recorded_by": "mcp:agent",
      "notes": "Opt-in (default OFF) SmartMemory live ingest + idempotent backfill sync. 8-round design gate, 3-round blueprint gate, 5-round impl review, coverage sweep. Full suite 4620+581+100 green."
    }
  ],
  "commit_sha": "fbe0de02a4817c4329daf4bd8e7d0026d9674613"
}
