{
  "code": "COMP-ROADMAP-ARCHIVE-GH",
  "description": "Two-document transactional publication for the GitHub tracker provider. COMP-ROADMAP-ARCHIVE v1 is local-provider only: GitHubProvider regenerates and publishes one roadmap document with a Contents API SHA check, and two independent Contents writes cannot claim atomicity. Publish the active/archive document set as one Git tree and one commit with a guarded ref update and conflict retry; an issue status transition may already be committed when publication fails, so report and repair that projection without repeating the transition. Provider parity for archival is complete only when this ships. Features M medium",
  "status": "PLANNED",
  "created": "2026-09-09",
  "profile": {
    "needs_prd": true,
    "needs_architecture": true,
    "needs_verification": true,
    "needs_report": true,
    "language": "node",
    "test_framework": "vitest"
  },
  "updated": "2026-09-09",
  "links": [
    {
      "kind": "surfaced_by",
      "to_code": "COMP-ROADMAP-ARCHIVE",
      "note": "cut from v1 at design review 2026-09-09"
    },
    {
      "kind": "depends_on",
      "to_code": "COMP-ROADMAP-ARCHIVE"
    }
  ]
}
